{
  "id": "urn:beispiel:erbausschlagung:PAKET",
  "version": "0.1.0",
  "datenart": "synthetisch",
  "personen": [
    {
      "id": "urn:beispiel:erbausschlagung:A-ERBLASSER",
      "bezeichnungen": [
        {
          "wert": "Synthetische Person A erblasser",
          "sprache": "de"
        }
      ]
    },
    {
      "id": "urn:beispiel:erbausschlagung:A-PERSON",
      "bezeichnungen": [
        {
          "wert": "Synthetische Person A person",
          "sprache": "de"
        }
      ]
    },
    {
      "id": "urn:beispiel:erbausschlagung:B-ERBLASSER",
      "bezeichnungen": [
        {
          "wert": "Synthetische Person B erblasser",
          "sprache": "de"
        }
      ]
    },
    {
      "id": "urn:beispiel:erbausschlagung:B-PERSON",
      "bezeichnungen": [
        {
          "wert": "Synthetische Person B person",
          "sprache": "de"
        }
      ]
    },
    {
      "id": "urn:beispiel:erbausschlagung:C-ERBLASSER",
      "bezeichnungen": [
        {
          "wert": "Synthetische Person C erblasser",
          "sprache": "de"
        }
      ]
    },
    {
      "id": "urn:beispiel:erbausschlagung:C-PERSON",
      "bezeichnungen": [
        {
          "wert": "Synthetische Person C person",
          "sprache": "de"
        }
      ]
    },
    {
      "id": "urn:beispiel:erbausschlagung:C-KIND",
      "bezeichnungen": [
        {
          "wert": "Synthetische Person C kind",
          "sprache": "de"
        }
      ]
    },
    {
      "id": "urn:beispiel:erbausschlagung:D-ERBLASSER",
      "bezeichnungen": [
        {
          "wert": "Synthetische Person D erblasser",
          "sprache": "de"
        }
      ]
    },
    {
      "id": "urn:beispiel:erbausschlagung:D-PERSON",
      "bezeichnungen": [
        {
          "wert": "Synthetische Person D person",
          "sprache": "de"
        }
      ]
    }
  ],
  "quellen": [
    {
      "id": "urn:beispiel:erbausschlagung:QUELLE",
      "bezeichnungen": [
        {
          "wert": "Frei erfundener Nachweisspeicher",
          "sprache": "de"
        }
      ]
    }
  ],
  "beziehungen": [
    {
      "id": "urn:beispiel:erbausschlagung:C-ELTERN-KIND",
      "typ": "eltern_kind",
      "subjekt_id": "urn:beispiel:erbausschlagung:C-PERSON",
      "objekt_id": "urn:beispiel:erbausschlagung:C-KIND",
      "quelle_id": "urn:beispiel:erbausschlagung:QUELLE",
      "fachliche_zeit": {
        "art": "intervall",
        "beginn": {
          "wert": "2018",
          "praezision": "jahr"
        },
        "ende": {
          "status": "offen"
        }
      },
      "erfasst_am": "2026-10-02T09:00:00Z",
      "pruefstatus": "bestaetigt"
    }
  ],
  "faelle": [
    {
      "id": "urn:beispiel:erbausschlagung:EA-A",
      "bezeichnungen": [
        {
          "wert": "Synthetischer Fall A: Vollzugsauftrag",
          "sprache": "de"
        }
      ],
      "erblasser_id": "urn:beispiel:erbausschlagung:A-ERBLASSER",
      "ausschlagende_person_id": "urn:beispiel:erbausschlagung:A-PERSON",
      "betroffene_person_ids": [
        "urn:beispiel:erbausschlagung:A-PERSON"
      ],
      "vollzugsweg": "notariat",
      "nachkontrolle": "vereinbart",
      "annahmerisiko": "keine_hinweise",
      "pruefungen": [
        {
          "id": "urn:beispiel:erbausschlagung:A-PRUEFUNG-A-PERSON-auftrag",
          "person_id": "urn:beispiel:erbausschlagung:A-PERSON",
          "typ": "auftrag",
          "status": "bestaetigt",
          "quelle_id": "urn:beispiel:erbausschlagung:QUELLE",
          "erfasst_am": "2026-10-02T09:00:00Z"
        },
        {
          "id": "urn:beispiel:erbausschlagung:A-PRUEFUNG-A-PERSON-frist",
          "person_id": "urn:beispiel:erbausschlagung:A-PERSON",
          "typ": "frist",
          "status": "bestaetigt",
          "quelle_id": "urn:beispiel:erbausschlagung:QUELLE",
          "erfasst_am": "2026-10-02T09:00:00Z"
        },
        {
          "id": "urn:beispiel:erbausschlagung:A-PRUEFUNG-A-PERSON-gericht",
          "person_id": "urn:beispiel:erbausschlagung:A-PERSON",
          "typ": "gericht",
          "status": "bestaetigt",
          "quelle_id": "urn:beispiel:erbausschlagung:QUELLE",
          "erfasst_am": "2026-10-02T09:00:00Z"
        },
        {
          "id": "urn:beispiel:erbausschlagung:A-PRUEFUNG-A-PERSON-form",
          "person_id": "urn:beispiel:erbausschlagung:A-PERSON",
          "typ": "form",
          "status": "bestaetigt",
          "quelle_id": "urn:beispiel:erbausschlagung:QUELLE",
          "erfasst_am": "2026-10-02T09:00:00Z"
        },
        {
          "id": "urn:beispiel:erbausschlagung:A-PRUEFUNG-A-PERSON-belehrung",
          "person_id": "urn:beispiel:erbausschlagung:A-PERSON",
          "typ": "belehrung",
          "status": "bestaetigt",
          "quelle_id": "urn:beispiel:erbausschlagung:QUELLE",
          "erfasst_am": "2026-10-02T09:00:00Z"
        },
        {
          "id": "urn:beispiel:erbausschlagung:A-PRUEFUNG-A-PERSON-vertretung",
          "person_id": "urn:beispiel:erbausschlagung:A-PERSON",
          "typ": "vertretung",
          "status": "bestaetigt",
          "quelle_id": "urn:beispiel:erbausschlagung:QUELLE",
          "erfasst_am": "2026-10-02T09:00:00Z"
        },
        {
          "id": "urn:beispiel:erbausschlagung:A-PRUEFUNG-A-PERSON-genehmigung",
          "person_id": "urn:beispiel:erbausschlagung:A-PERSON",
          "typ": "genehmigung",
          "status": "bestaetigt",
          "quelle_id": "urn:beispiel:erbausschlagung:QUELLE",
          "erfasst_am": "2026-10-02T09:00:00Z"
        },
        {
          "id": "urn:beispiel:erbausschlagung:A-PRUEFUNG-A-PERSON-annahmerisiko",
          "person_id": "urn:beispiel:erbausschlagung:A-PERSON",
          "typ": "annahmerisiko",
          "status": "bestaetigt",
          "quelle_id": "urn:beispiel:erbausschlagung:QUELLE",
          "erfasst_am": "2026-10-02T09:00:00Z"
        }
      ]
    },
    {
      "id": "urn:beispiel:erbausschlagung:EA-B",
      "bezeichnungen": [
        {
          "wert": "Synthetischer Fall B: Selbsteinreichung",
          "sprache": "de"
        }
      ],
      "erblasser_id": "urn:beispiel:erbausschlagung:B-ERBLASSER",
      "ausschlagende_person_id": "urn:beispiel:erbausschlagung:B-PERSON",
      "betroffene_person_ids": [
        "urn:beispiel:erbausschlagung:B-PERSON"
      ],
      "vollzugsweg": "selbsteinreichung",
      "nachkontrolle": "nicht_vereinbart",
      "annahmerisiko": "keine_hinweise",
      "pruefungen": [
        {
          "id": "urn:beispiel:erbausschlagung:B-PRUEFUNG-B-PERSON-auftrag",
          "person_id": "urn:beispiel:erbausschlagung:B-PERSON",
          "typ": "auftrag",
          "status": "bestaetigt",
          "quelle_id": "urn:beispiel:erbausschlagung:QUELLE",
          "erfasst_am": "2026-10-02T09:00:00Z"
        },
        {
          "id": "urn:beispiel:erbausschlagung:B-PRUEFUNG-B-PERSON-frist",
          "person_id": "urn:beispiel:erbausschlagung:B-PERSON",
          "typ": "frist",
          "status": "bestaetigt",
          "quelle_id": "urn:beispiel:erbausschlagung:QUELLE",
          "erfasst_am": "2026-10-02T09:00:00Z"
        },
        {
          "id": "urn:beispiel:erbausschlagung:B-PRUEFUNG-B-PERSON-gericht",
          "person_id": "urn:beispiel:erbausschlagung:B-PERSON",
          "typ": "gericht",
          "status": "bestaetigt",
          "quelle_id": "urn:beispiel:erbausschlagung:QUELLE",
          "erfasst_am": "2026-10-02T09:00:00Z"
        },
        {
          "id": "urn:beispiel:erbausschlagung:B-PRUEFUNG-B-PERSON-form",
          "person_id": "urn:beispiel:erbausschlagung:B-PERSON",
          "typ": "form",
          "status": "bestaetigt",
          "quelle_id": "urn:beispiel:erbausschlagung:QUELLE",
          "erfasst_am": "2026-10-02T09:00:00Z"
        },
        {
          "id": "urn:beispiel:erbausschlagung:B-PRUEFUNG-B-PERSON-belehrung",
          "person_id": "urn:beispiel:erbausschlagung:B-PERSON",
          "typ": "belehrung",
          "status": "bestaetigt",
          "quelle_id": "urn:beispiel:erbausschlagung:QUELLE",
          "erfasst_am": "2026-10-02T09:00:00Z"
        },
        {
          "id": "urn:beispiel:erbausschlagung:B-PRUEFUNG-B-PERSON-vertretung",
          "person_id": "urn:beispiel:erbausschlagung:B-PERSON",
          "typ": "vertretung",
          "status": "bestaetigt",
          "quelle_id": "urn:beispiel:erbausschlagung:QUELLE",
          "erfasst_am": "2026-10-02T09:00:00Z"
        },
        {
          "id": "urn:beispiel:erbausschlagung:B-PRUEFUNG-B-PERSON-genehmigung",
          "person_id": "urn:beispiel:erbausschlagung:B-PERSON",
          "typ": "genehmigung",
          "status": "bestaetigt",
          "quelle_id": "urn:beispiel:erbausschlagung:QUELLE",
          "erfasst_am": "2026-10-02T09:00:00Z"
        },
        {
          "id": "urn:beispiel:erbausschlagung:B-PRUEFUNG-B-PERSON-annahmerisiko",
          "person_id": "urn:beispiel:erbausschlagung:B-PERSON",
          "typ": "annahmerisiko",
          "status": "bestaetigt",
          "quelle_id": "urn:beispiel:erbausschlagung:QUELLE",
          "erfasst_am": "2026-10-02T09:00:00Z"
        }
      ]
    },
    {
      "id": "urn:beispiel:erbausschlagung:EA-C",
      "bezeichnungen": [
        {
          "wert": "Synthetischer Fall C: Minderjähriges Kind als möglicherweise nachrückende Person",
          "sprache": "de"
        }
      ],
      "erblasser_id": "urn:beispiel:erbausschlagung:C-ERBLASSER",
      "ausschlagende_person_id": "urn:beispiel:erbausschlagung:C-PERSON",
      "betroffene_person_ids": [
        "urn:beispiel:erbausschlagung:C-PERSON",
        "urn:beispiel:erbausschlagung:C-KIND"
      ],
      "vollzugsweg": "notariat",
      "nachkontrolle": "vereinbart",
      "annahmerisiko": "keine_hinweise",
      "pruefungen": [
        {
          "id": "urn:beispiel:erbausschlagung:C-PRUEFUNG-C-PERSON-auftrag",